{
  "dataset_version": "1.0.0",
  "package_id": "PKG-012",
  "document_id": "PKG-012_INV",
  "document_type": "commercial_invoice",
  "language": "en",
  "template_id": "modern_grid",
  "file_name": "PKG-012_commercial_invoice.pdf",
  "page_dimensions": {
    "unit": "point",
    "width": 595.2755905511812,
    "height": 841.8897637795277,
    "page_count": 1
  },
  "scenario": {
    "scenario_id": "BENIGN_FORMATTING_VARIATIONS",
    "category": "benign_variation",
    "description": "Benign formatting variations: Dates formatted as 2026-10-22 vs 22/10/2026, buyer case differences, decimal periods vs commas. Semantically identical match."
  },
  "fields": [
    {
      "canonical_name": "document_number",
      "raw_value": "INV-2026-012",
      "normalized_value": "INV-2026-012",
      "data_type": "string",
      "page": 1,
      "bbox": [
        450,
        83.39,
        512.26,
        93.89
      ],
      "status": "present"
    },
    {
      "canonical_name": "issue_date",
      "raw_value": "2026-10-22",
      "normalized_value": "2026-10-22",
      "data_type": "date",
      "page": 1,
      "bbox": [
        450,
        98.39,
        501.15,
        108.89
      ],
      "status": "present"
    },
    {
      "canonical_name": "order_number",
      "raw_value": "PO-2026-USA-012",
      "normalized_value": "PO-2026-USA-012",
      "data_type": "string",
      "page": 1,
      "bbox": [
        450,
        113.39,
        533.93,
        123.89
      ],
      "status": "present"
    },
    {
      "canonical_name": "seller_name",
      "raw_value": "VIETNAM SPICE TRADING LTD",
      "normalized_value": "VIETNAM SPICE TRADING LTD",
      "data_type": "string",
      "page": 1,
      "bbox": [
        45,
        98.39,
        193.33,
        108.89
      ],
      "status": "present"
    },
    {
      "canonical_name": "seller_address",
      "raw_value": "Hamlet 3, Xuan Loc, Dong Nai, Vietnam",
      "normalized_value": "Hamlet 3, Xuan Loc, Dong Nai, Vietnam",
      "data_type": "string",
      "page": 1,
      "bbox": [
        45,
        109.89,
        345,
        129.89
      ],
      "status": "present"
    },
    {
      "canonical_name": "buyer_name",
      "raw_value": "GLOBAL CONDIMENTS CORP",
      "normalized_value": "GLOBAL CONDIMENTS CORP",
      "data_type": "string",
      "page": 1,
      "bbox": [
        45,
        158.39,
        188.89,
        168.89
      ],
      "status": "present"
    },
    {
      "canonical_name": "buyer_address",
      "raw_value": "742 Evergreen Terrace, Springfield, OR 97477, USA",
      "normalized_value": "742 Evergreen Terrace, Springfield, OR 97477, USA",
      "data_type": "string",
      "page": 1,
      "bbox": [
        45,
        169.89,
        345,
        189.89
      ],
      "status": "present"
    },
    {
      "canonical_name": "port_of_loading",
      "raw_value": "Cat Lai, Ho Chi Minh",
      "normalized_value": "Cat Lai, Ho Chi Minh",
      "data_type": "string",
      "page": 1,
      "bbox": [
        125,
        205.09,
        198.81,
        213.49
      ],
      "status": "present"
    },
    {
      "canonical_name": "port_of_discharge",
      "raw_value": "Los Angeles, USA",
      "normalized_value": "Los Angeles, USA",
      "data_type": "string",
      "page": 1,
      "bbox": [
        365,
        205.09,
        429.93,
        213.49
      ],
      "status": "present"
    },
    {
      "canonical_name": "incoterm",
      "raw_value": "FOB",
      "normalized_value": "FOB",
      "data_type": "string",
      "page": 1,
      "bbox": [
        365,
        220.09,
        381.45,
        228.49
      ],
      "status": "present"
    },
    {
      "canonical_name": "currency",
      "raw_value": "USD",
      "normalized_value": "USD",
      "data_type": "currency",
      "page": 1,
      "bbox": [
        510,
        220.09,
        526.89,
        228.49
      ],
      "status": "present"
    },
    {
      "canonical_name": "total_amount",
      "raw_value": "USD 38,000.00",
      "normalized_value": 38000.0,
      "data_type": "number",
      "page": 1,
      "bbox": [
        480,
        300.24,
        541.54,
        309.69
      ],
      "status": "present"
    }
  ],
  "line_items": [
    {
      "line_number": 1,
      "sku": "CINNAMON-SPLIT",
      "description": "Split Cassia Cinnamon Premium Quality",
      "quantity": 10.0,
      "unit": "MT",
      "unit_price": 3800.0,
      "line_total": 38000.0,
      "gross_weight": null,
      "net_weight": null,
      "package_count": 1000,
      "package_type": "CARTONS",
      "page": 1,
      "bbox": [
        40,
        260.89,
        555,
        274.89
      ]
    }
  ]
}