{
  "dataset_version": "1.0.0",
  "package_id": "PKG-002",
  "document_id": "PKG-002_PL",
  "document_type": "packing_list",
  "language": "vi",
  "template_id": "modern_grid",
  "file_name": "PKG-002_packing_list.pdf",
  "page_dimensions": {
    "unit": "point",
    "width": 595.2755905511812,
    "height": 841.8897637795277,
    "page_count": 1
  },
  "scenario": {
    "scenario_id": "CLEAN_BASELINE_VI",
    "category": "clean",
    "description": "Bộ chứng từ xuất khẩu mẫu sạch: Tiếng Việt, các chứng từ hoàn toàn khớp."
  },
  "fields": [
    {
      "canonical_name": "document_number",
      "raw_value": "PK-2026-002",
      "normalized_value": "PK-2026-002",
      "data_type": "string",
      "page": 1,
      "bbox": [
        450,
        83.39,
        508.93,
        93.89
      ],
      "status": "present"
    },
    {
      "canonical_name": "issue_date",
      "raw_value": "2026-10-18",
      "normalized_value": "2026-10-18",
      "data_type": "date",
      "page": 1,
      "bbox": [
        450,
        98.39,
        501.15,
        108.89
      ],
      "status": "present"
    },
    {
      "canonical_name": "order_number",
      "raw_value": "DH-2026-TYO-02",
      "normalized_value": "DH-2026-TYO-02",
      "data_type": "string",
      "page": 1,
      "bbox": [
        450,
        113.39,
        528.36,
        123.89
      ],
      "status": "present"
    },
    {
      "canonical_name": "seller_name",
      "raw_value": "CÔNG TY CP NÔNG SẢN ĐÀ NẴNG",
      "normalized_value": "CÔNG TY CP NÔNG SẢN ĐÀ NẴNG",
      "data_type": "string",
      "page": 1,
      "bbox": [
        45,
        98.39,
        213.34,
        108.89
      ],
      "status": "present"
    },
    {
      "canonical_name": "seller_address",
      "raw_value": "Số 45 Đường Bạch Đằng, Quận Hải Châu, TP. Đà Nẵng, Việt Nam",
      "normalized_value": "Số 45 Đường Bạch Đằng, Quận Hải Châu, TP. Đà Nẵng, Việt Nam",
      "data_type": "string",
      "page": 1,
      "bbox": [
        45,
        109.89,
        345,
        129.89
      ],
      "status": "present"
    },
    {
      "canonical_name": "buyer_name",
      "raw_value": "TOKYO TRADING CO., LTD.",
      "normalized_value": "TOKYO TRADING CO., LTD.",
      "data_type": "string",
      "page": 1,
      "bbox": [
        45,
        158.39,
        177.22,
        168.89
      ],
      "status": "present"
    },
    {
      "canonical_name": "buyer_address",
      "raw_value": "3-2-1 Marunouchi, Chiyoda-ku, Tokyo 100-0005, Japan",
      "normalized_value": "3-2-1 Marunouchi, Chiyoda-ku, Tokyo 100-0005, Japan",
      "data_type": "string",
      "page": 1,
      "bbox": [
        45,
        169.89,
        345,
        189.89
      ],
      "status": "present"
    },
    {
      "canonical_name": "port_of_loading",
      "raw_value": "Cảng Tiên Sa, Đà Nẵng",
      "normalized_value": "Cảng Tiên Sa, Đà Nẵng",
      "data_type": "string",
      "page": 1,
      "bbox": [
        125,
        205.09,
        209.94,
        213.49
      ],
      "status": "present"
    },
    {
      "canonical_name": "port_of_discharge",
      "raw_value": "Cảng Yokohama, Nhật Bản",
      "normalized_value": "Cảng Yokohama, Nhật Bản",
      "data_type": "string",
      "page": 1,
      "bbox": [
        365,
        205.09,
        462.39,
        213.49
      ],
      "status": "present"
    },
    {
      "canonical_name": "incoterm",
      "raw_value": "CIF",
      "normalized_value": "CIF",
      "data_type": "string",
      "page": 1,
      "bbox": [
        365,
        220.09,
        377.89,
        228.49
      ],
      "status": "present"
    },
    {
      "canonical_name": "total_net_weight",
      "raw_value": "20.000,00 KG",
      "normalized_value": 20000.0,
      "data_type": "number",
      "page": 1,
      "bbox": [
        380,
        300.24,
        436.04,
        309.69
      ],
      "status": "present"
    },
    {
      "canonical_name": "total_gross_weight",
      "raw_value": "20.400,00 KG",
      "normalized_value": 20400.0,
      "data_type": "number",
      "page": 1,
      "bbox": [
        380,
        314.24,
        436.04,
        323.69
      ],
      "status": "present"
    }
  ],
  "line_items": [
    {
      "line_number": 1,
      "sku": "PEPPER-BLACK-500",
      "description": "Tiêu đen xuất khẩu loại 500g/l",
      "quantity": 20.0,
      "unit": "TẤN",
      "unit_price": null,
      "line_total": null,
      "gross_weight": 20400.0,
      "net_weight": 20000.0,
      "package_count": 400,
      "package_type": "BAO ĐAY",
      "page": 1,
      "bbox": [
        40,
        260.89,
        555,
        274.89
      ]
    }
  ]
}