{
  "dataset_version": "1.0.0",
  "package_id": "PKG-011",
  "document_id": "PKG-011_PL",
  "document_type": "packing_list",
  "language": "vi",
  "template_id": "classic_standard",
  "file_name": "PKG-011_packing_list.pdf",
  "page_dimensions": {
    "unit": "point",
    "width": 595.2755905511812,
    "height": 841.8897637795277,
    "page_count": 1
  },
  "scenario": {
    "scenario_id": "IDENTIFIER_ORDER_MISMATCH_VI",
    "category": "discrepancy",
    "description": "Sai lệch mã đơn hàng: Hóa đơn tham chiếu DH-2026-LON-901 trong khi Phiếu đóng gói ghi DH-2026-LON-999."
  },
  "fields": [
    {
      "canonical_name": "document_number",
      "raw_value": "PK-2026-011",
      "normalized_value": "PK-2026-011",
      "data_type": "string",
      "page": 1,
      "bbox": [
        450,
        83.39,
        508.93,
        93.89
      ],
      "status": "present"
    },
    {
      "canonical_name": "issue_date",
      "raw_value": "2026-10-22",
      "normalized_value": "2026-10-22",
      "data_type": "date",
      "page": 1,
      "bbox": [
        450,
        98.39,
        501.15,
        108.89
      ],
      "status": "present"
    },
    {
      "canonical_name": "order_number",
      "raw_value": "DH-2026-LON-999",
      "normalized_value": "DH-2026-LON-999",
      "data_type": "string",
      "page": 1,
      "bbox": [
        450,
        113.39,
        533.93,
        123.89
      ],
      "status": "present"
    },
    {
      "canonical_name": "seller_name",
      "raw_value": "CÔNG TY TNHH TRÁI CÂY NHIỆT ĐỚI MEKONG",
      "normalized_value": "CÔNG TY TNHH TRÁI CÂY NHIỆT ĐỚI MEKONG",
      "data_type": "string",
      "page": 1,
      "bbox": [
        45,
        98.39,
        272.97,
        108.89
      ],
      "status": "present"
    },
    {
      "canonical_name": "seller_address",
      "raw_value": "Km 1964, Quốc lộ 1A, Châu Thành, Tiền Giang, Việt Nam",
      "normalized_value": "Km 1964, Quốc lộ 1A, Châu Thành, Tiền Giang, Việt Nam",
      "data_type": "string",
      "page": 1,
      "bbox": [
        45,
        109.89,
        345,
        129.89
      ],
      "status": "present"
    },
    {
      "canonical_name": "buyer_name",
      "raw_value": "SYDNEY FRESH MARKETS PTY",
      "normalized_value": "SYDNEY FRESH MARKETS PTY",
      "data_type": "string",
      "page": 1,
      "bbox": [
        45,
        158.39,
        197.24,
        168.89
      ],
      "status": "present"
    },
    {
      "canonical_name": "buyer_address",
      "raw_value": "250 Parramatta Road, Homebush NSW 2140, Australia",
      "normalized_value": "250 Parramatta Road, Homebush NSW 2140, Australia",
      "data_type": "string",
      "page": 1,
      "bbox": [
        45,
        169.89,
        345,
        189.89
      ],
      "status": "present"
    },
    {
      "canonical_name": "port_of_loading",
      "raw_value": "Cảng Cát Lái, TP. Hồ Chí Minh",
      "normalized_value": "Cảng Cát Lái, TP. Hồ Chí Minh",
      "data_type": "string",
      "page": 1,
      "bbox": [
        125,
        205.09,
        235.27,
        213.49
      ],
      "status": "present"
    },
    {
      "canonical_name": "port_of_discharge",
      "raw_value": "Cảng Sydney, Úc",
      "normalized_value": "Cảng Sydney, Úc",
      "data_type": "string",
      "page": 1,
      "bbox": [
        365,
        205.09,
        427.25,
        213.49
      ],
      "status": "present"
    },
    {
      "canonical_name": "incoterm",
      "raw_value": "CIF",
      "normalized_value": "CIF",
      "data_type": "string",
      "page": 1,
      "bbox": [
        365,
        220.09,
        377.89,
        228.49
      ],
      "status": "present"
    },
    {
      "canonical_name": "total_net_weight",
      "raw_value": "8.000,00 KG",
      "normalized_value": 8000.0,
      "data_type": "number",
      "page": 1,
      "bbox": [
        380,
        300.24,
        431.03,
        309.69
      ],
      "status": "present"
    },
    {
      "canonical_name": "total_gross_weight",
      "raw_value": "8.800,00 KG",
      "normalized_value": 8800.0,
      "data_type": "number",
      "page": 1,
      "bbox": [
        380,
        314.24,
        431.03,
        323.69
      ],
      "status": "present"
    }
  ],
  "line_items": [
    {
      "line_number": 1,
      "sku": "DRAGON-FRUIT-FD",
      "description": "Thanh long đỏ sấy thăng hoa xuất khẩu",
      "quantity": 800.0,
      "unit": "THÙNG",
      "unit_price": null,
      "line_total": null,
      "gross_weight": 8800.0,
      "net_weight": 8000.0,
      "package_count": 800,
      "package_type": "THÙNG CARTON",
      "page": 1,
      "bbox": [
        40,
        260.89,
        555,
        274.89
      ]
    }
  ]
}