{
  "dataset_version": "1.0.0",
  "package_id": "PKG-005",
  "document_id": "PKG-005_INV",
  "document_type": "commercial_invoice",
  "language": "en",
  "template_id": "classic_standard",
  "file_name": "PKG-005_commercial_invoice.pdf",
  "page_dimensions": {
    "unit": "point",
    "width": 595.2755905511812,
    "height": 841.8897637795277,
    "page_count": 1
  },
  "scenario": {
    "scenario_id": "GROSS_WEIGHT_MISMATCH_EN",
    "category": "discrepancy",
    "description": "Gross weight mismatch: Invoice shows 25,500 KG while Packing List shows 26,800 KG."
  },
  "fields": [
    {
      "canonical_name": "document_number",
      "raw_value": "INV-2026-005",
      "normalized_value": "INV-2026-005",
      "data_type": "string",
      "page": 1,
      "bbox": [
        450,
        83.39,
        512.26,
        93.89
      ],
      "status": "present"
    },
    {
      "canonical_name": "issue_date",
      "raw_value": "2026-10-20",
      "normalized_value": "2026-10-20",
      "data_type": "date",
      "page": 1,
      "bbox": [
        450,
        98.39,
        501.15,
        108.89
      ],
      "status": "present"
    },
    {
      "canonical_name": "order_number",
      "raw_value": "PO-2026-SG-005",
      "normalized_value": "PO-2026-SG-005",
      "data_type": "string",
      "page": 1,
      "bbox": [
        450,
        113.39,
        527.82,
        123.89
      ],
      "status": "present"
    },
    {
      "canonical_name": "seller_name",
      "raw_value": "MEKONG DELTA AGRO PRODUCTS",
      "normalized_value": "MEKONG DELTA AGRO PRODUCTS",
      "data_type": "string",
      "page": 1,
      "bbox": [
        45,
        98.39,
        217.78,
        108.89
      ],
      "status": "present"
    },
    {
      "canonical_name": "seller_address",
      "raw_value": "Lot B4, Tra Noc Industrial Zone, Can Tho, Vietnam",
      "normalized_value": "Lot B4, Tra Noc Industrial Zone, Can Tho, Vietnam",
      "data_type": "string",
      "page": 1,
      "bbox": [
        45,
        109.89,
        345,
        129.89
      ],
      "status": "present"
    },
    {
      "canonical_name": "buyer_name",
      "raw_value": "LION CITY COMMODITIES PTE LTD",
      "normalized_value": "LION CITY COMMODITIES PTE LTD",
      "data_type": "string",
      "page": 1,
      "bbox": [
        45,
        158.39,
        213.33,
        168.89
      ],
      "status": "present"
    },
    {
      "canonical_name": "buyer_address",
      "raw_value": "10 Collyer Quay, #14-01 Ocean Financial Centre, Singapore 049315",
      "normalized_value": "10 Collyer Quay, #14-01 Ocean Financial Centre, Singapore 049315",
      "data_type": "string",
      "page": 1,
      "bbox": [
        45,
        169.89,
        345,
        189.89
      ],
      "status": "present"
    },
    {
      "canonical_name": "port_of_loading",
      "raw_value": "Can Tho Port, Can Tho",
      "normalized_value": "Can Tho Port, Can Tho",
      "data_type": "string",
      "page": 1,
      "bbox": [
        125,
        205.09,
        207.71,
        213.49
      ],
      "status": "present"
    },
    {
      "canonical_name": "port_of_discharge",
      "raw_value": "Jurong Port, Singapore",
      "normalized_value": "Jurong Port, Singapore",
      "data_type": "string",
      "page": 1,
      "bbox": [
        365,
        205.09,
        447.27,
        213.49
      ],
      "status": "present"
    },
    {
      "canonical_name": "incoterm",
      "raw_value": "FOB",
      "normalized_value": "FOB",
      "data_type": "string",
      "page": 1,
      "bbox": [
        365,
        220.09,
        381.45,
        228.49
      ],
      "status": "present"
    },
    {
      "canonical_name": "currency",
      "raw_value": "USD",
      "normalized_value": "USD",
      "data_type": "currency",
      "page": 1,
      "bbox": [
        510,
        220.09,
        526.89,
        228.49
      ],
      "status": "present"
    },
    {
      "canonical_name": "total_amount",
      "raw_value": "USD 26,000.00",
      "normalized_value": 26000.0,
      "data_type": "number",
      "page": 1,
      "bbox": [
        480,
        300.24,
        541.54,
        309.69
      ],
      "status": "present"
    }
  ],
  "line_items": [
    {
      "line_number": 1,
      "sku": "WHITE-RICE-5PCT",
      "description": "Vietnamese Long Grain White Rice 5% Broken",
      "quantity": 50.0,
      "unit": "MT",
      "unit_price": 520.0,
      "line_total": 26000.0,
      "gross_weight": null,
      "net_weight": null,
      "package_count": 1000,
      "package_type": "BAGS",
      "page": 1,
      "bbox": [
        40,
        260.89,
        555,
        274.89
      ]
    }
  ]
}