{
  "dataset_version": "1.0.0",
  "package_id": "PKG-008",
  "document_id": "PKG-008_PL",
  "document_type": "packing_list",
  "language": "vi",
  "template_id": "classic_standard",
  "file_name": "PKG-008_packing_list.pdf",
  "page_dimensions": {
    "unit": "point",
    "width": 595.2755905511812,
    "height": 841.8897637795277,
    "page_count": 1
  },
  "scenario": {
    "scenario_id": "PARTY_SELLER_MISMATCH_VI",
    "category": "discrepancy",
    "description": "Sai lệch bên bán/người gửi: Hóa đơn ghi Cty Nông sản Sài Gòn nhưng Phiếu đóng gói ghi Cty Hoàng Gia."
  },
  "fields": [
    {
      "canonical_name": "document_number",
      "raw_value": "PK-2026-008",
      "normalized_value": "PK-2026-008",
      "data_type": "string",
      "page": 1,
      "bbox": [
        450,
        83.39,
        508.93,
        93.89
      ],
      "status": "present"
    },
    {
      "canonical_name": "issue_date",
      "raw_value": "2026-10-21",
      "normalized_value": "2026-10-21",
      "data_type": "date",
      "page": 1,
      "bbox": [
        450,
        98.39,
        501.15,
        108.89
      ],
      "status": "present"
    },
    {
      "canonical_name": "order_number",
      "raw_value": "DH-2026-DXB-008",
      "normalized_value": "DH-2026-DXB-008",
      "data_type": "string",
      "page": 1,
      "bbox": [
        450,
        113.39,
        533.93,
        123.89
      ],
      "status": "present"
    },
    {
      "canonical_name": "seller_name",
      "raw_value": "CÔNG TY TNHH XUẤT NHẬP KHẨU HOÀNG GIA",
      "normalized_value": "CÔNG TY TNHH XUẤT NHẬP KHẨU HOÀNG GIA",
      "data_type": "string",
      "page": 1,
      "bbox": [
        45,
        98.39,
        274.44,
        108.89
      ],
      "status": "present"
    },
    {
      "canonical_name": "seller_address",
      "raw_value": "180 Đường Nguyễn Thị Minh Khai, Quận 3, TP. Hồ Chí Minh, Việt Nam",
      "normalized_value": "180 Đường Nguyễn Thị Minh Khai, Quận 3, TP. Hồ Chí Minh, Việt Nam",
      "data_type": "string",
      "page": 1,
      "bbox": [
        45,
        109.89,
        345,
        129.89
      ],
      "status": "present"
    },
    {
      "canonical_name": "buyer_name",
      "raw_value": "DUBAI GENERAL TRADING LLC",
      "normalized_value": "DUBAI GENERAL TRADING LLC",
      "data_type": "string",
      "page": 1,
      "bbox": [
        45,
        158.39,
        198.88,
        168.89
      ],
      "status": "present"
    },
    {
      "canonical_name": "buyer_address",
      "raw_value": "Al Rigga Road, Deira, P.O. Box 4521, Dubai, UAE",
      "normalized_value": "Al Rigga Road, Deira, P.O. Box 4521, Dubai, UAE",
      "data_type": "string",
      "page": 1,
      "bbox": [
        45,
        169.89,
        345,
        189.89
      ],
      "status": "present"
    },
    {
      "canonical_name": "port_of_loading",
      "raw_value": "Cảng Cát Lái, TP. Hồ Chí Minh",
      "normalized_value": "Cảng Cát Lái, TP. Hồ Chí Minh",
      "data_type": "string",
      "page": 1,
      "bbox": [
        125,
        205.09,
        235.27,
        213.49
      ],
      "status": "present"
    },
    {
      "canonical_name": "port_of_discharge",
      "raw_value": "Cảng Jebel Ali, Dubai",
      "normalized_value": "Cảng Jebel Ali, Dubai",
      "data_type": "string",
      "page": 1,
      "bbox": [
        365,
        205.09,
        441.93,
        213.49
      ],
      "status": "present"
    },
    {
      "canonical_name": "incoterm",
      "raw_value": "CIF",
      "normalized_value": "CIF",
      "data_type": "string",
      "page": 1,
      "bbox": [
        365,
        220.09,
        377.89,
        228.49
      ],
      "status": "present"
    },
    {
      "canonical_name": "total_net_weight",
      "raw_value": "20.000,00 KG",
      "normalized_value": 20000.0,
      "data_type": "number",
      "page": 1,
      "bbox": [
        380,
        300.24,
        436.04,
        309.69
      ],
      "status": "present"
    },
    {
      "canonical_name": "total_gross_weight",
      "raw_value": "21.500,00 KG",
      "normalized_value": 21500.0,
      "data_type": "number",
      "page": 1,
      "bbox": [
        380,
        314.24,
        436.04,
        323.69
      ],
      "status": "present"
    }
  ],
  "line_items": [
    {
      "line_number": 1,
      "sku": "TEA-GREEN-OP",
      "description": "Chè xanh xuất khẩu Tân Cương loại OP",
      "quantity": 1000.0,
      "unit": "THÙNG",
      "unit_price": null,
      "line_total": null,
      "gross_weight": 21500.0,
      "net_weight": 20000.0,
      "package_count": 1000,
      "package_type": "THÙNG CARTON",
      "page": 1,
      "bbox": [
        40,
        260.89,
        555,
        274.89
      ]
    }
  ]
}